{
  "count": 2,
  "format": "https://trackai.dev/attesta/security-findings-seal-document/v1",
  "generations": {
    "task6a": 1,
    "v2": 1
  },
  "previous": null,
  "rows": [
    {
      "digest": "sha256:ad3c15e3cf45b3777214c057555c376d70aa57a75250e1305b73459cef1572e6",
      "id": "0f000000-0000-4000-8000-000000000001"
    },
    {
      "digest": "sha256:4c4d965e48bc878365206f970cc4e3e4a155ef4d534b364c818b1454173eedc8",
      "id": "0f000000-0000-4000-8000-000000000002"
    }
  ],
  "rows_root": "sha256:b594625bdd4f52691549178ca7fed67c24e16cc5ad75841e24dcc6a95d4de896",
  "tenant_id": "11111111-1111-4111-8111-111111111111",
  "window": {
    "from": "2026-10-18T06:00:00.000000Z",
    "to": "2026-10-18T07:00:00.000000Z"
  }
}
